{
  "$schema": "/idl/meta_app.schema.v0.1.json",
  "schema": "meta-app.v0.1",
  "version": "0.2.0",
  "protocolId": "kamino-klend-mainnet",
  "label": "Kamino Klend Mainnet",
  "apps": {
    "view_position": {
      "title": "View Position",
      "description": "Read reserve and wallet position details.",
      "entry_step": "view",
      "steps": [
        {
          "id": "view",
          "operation": "view_position",
          "title": "View",
          "description": "Read the current position snapshot.",
          "actions": [
            {
              "id": "view_run",
              "kind": "run",
              "label": "Refresh Position",
              "mode": "view",
              "variant": "primary"
            }
          ],
          "status_text": {
            "running": "Loading position...",
            "success": "Position loaded.",
            "error": "Position read failed: {error}"
          },
          "label": "View",
          "requires_paths": []
        }
      ],
      "label": "View Position"
    },
    "deposit_liquidity": {
      "title": "Deposit Liquidity",
      "description": "Deposit liquidity into a Kamino reserve.",
      "entry_step": "deposit",
      "steps": [
        {
          "id": "deposit",
          "operation": "deposit_reserve_liquidity",
          "title": "Deposit",
          "description": "Simulate first, then send deposit.",
          "actions": [
            {
              "id": "deposit_simulate",
              "kind": "run",
              "label": "Simulate Deposit",
              "mode": "simulate",
              "variant": "primary"
            },
            {
              "id": "deposit_send",
              "kind": "run",
              "label": "Send Deposit",
              "mode": "send",
              "variant": "secondary"
            }
          ],
          "status_text": {
            "running": "Executing deposit...",
            "success": "Deposit completed.",
            "error": "Deposit failed: {error}"
          },
          "label": "Deposit",
          "requires_paths": []
        }
      ],
      "label": "Deposit Liquidity"
    },
    "withdraw_liquidity": {
      "title": "Withdraw Liquidity",
      "description": "Redeem reserve collateral back to liquidity.",
      "entry_step": "withdraw",
      "steps": [
        {
          "id": "withdraw",
          "operation": "redeem_reserve_collateral",
          "title": "Withdraw",
          "description": "Simulate first, then send withdrawal.",
          "actions": [
            {
              "id": "withdraw_simulate",
              "kind": "run",
              "label": "Simulate Withdraw",
              "mode": "simulate",
              "variant": "primary"
            },
            {
              "id": "withdraw_send",
              "kind": "run",
              "label": "Send Withdraw",
              "mode": "send",
              "variant": "secondary"
            }
          ],
          "status_text": {
            "running": "Executing withdrawal...",
            "success": "Withdrawal completed.",
            "error": "Withdrawal failed: {error}"
          },
          "label": "Withdraw",
          "requires_paths": []
        }
      ],
      "label": "Withdraw Liquidity"
    }
  }
}
